{
  "schema_version": "0.1",
  "operation": "BUILD",
  "status": "HOLD",
  "FILES_STATUS": "HASHED",
  "CLOSURE_STATUS": "INCOMPLETE",
  "verified": false,
  "plan_sha256": "18ccaad8db64b92c8ce45c0bd226cab37c81f05db5d679698d3c60c1bf268a8a",
  "binding_sha256": "4078593b29238c38baafa7e8604bd21f544d59281d8f64a0b3d4844536bf9910",
  "identity_sha256": null,
  "logical_identity": null,
  "diagnostic_identity": {
    "label": "partial / non-reusable",
    "value": {
      "domain": "IDENTITY_LOCK/v0",
      "schema_version": "0.1",
      "groups": [
        {
          "identity_kind": "backend",
          "metadata": {},
          "closure_policy": {
            "version": "0.1",
            "policy_id": "windows-bambu-02080261-runner020-bounded-v0.1",
            "sha256": "0e723c91813e0c126f43852bf8bf25faf358d66e42e032fa10c4792b520e8af3",
            "status": "INCOMPLETE",
            "path_semantics": "UNRESOLVED",
            "unresolved": [
              "Exact loaded Windows CRT/API-set/system DLL identities and search configuration",
              "Transitive/dynamic BambuStudio.dll dependency set including remaining static import candidates",
              "Exact resource/default/template inheritance and fallback selection with explicit flat profiles",
              "Effective datadir/user config discovery for configured route; current run/job binding not independently established",
              "Actual WindowsApps Python runtime/stdlib/native-extension/import closure",
              "Closed effective inherited environment and safe semantic-secret policy",
              "Path/basename/cwd/TEMP/output relocation semantics for exact installed engine"
            ]
          },
          "manifest": {
            "schema_version": "0.1",
            "entries": [
              {
                "logical_name": "job.py",
                "sha256": "5526026f2bb7ab28b109e9dad6b1cd753d51e07b5b78fbf76a3d836a9c2c66cb",
                "size": "25419",
                "role": "execution_source"
              },
              {
                "logical_name": "progress.py",
                "sha256": "0cbb84245e6b3252b14838bda1cd1f89f93c98b4b39016e08cdd78f8c3362622",
                "size": "3856",
                "role": "execution_source"
              },
              {
                "logical_name": "runner.py",
                "sha256": "405df011733de4cf469305a29c8609e1aa468202716c05d3cdb905435d3fde28",
                "size": "26496",
                "role": "execution_source"
              }
            ]
          }
        },
        {
          "identity_kind": "engine",
          "metadata": {
            "declared_version": "02.08.02.61",
            "platform_abi": "Windows-PE32+-AMD64"
          },
          "closure_policy": {
            "version": "0.1",
            "policy_id": "windows-bambu-02080261-runner020-bounded-v0.1",
            "sha256": "0e723c91813e0c126f43852bf8bf25faf358d66e42e032fa10c4792b520e8af3",
            "status": "INCOMPLETE",
            "path_semantics": "UNRESOLVED",
            "unresolved": [
              "Exact loaded Windows CRT/API-set/system DLL identities and search configuration",
              "Transitive/dynamic BambuStudio.dll dependency set including remaining static import candidates",
              "Exact resource/default/template inheritance and fallback selection with explicit flat profiles",
              "Effective datadir/user config discovery for configured route; current run/job binding not independently established",
              "Actual WindowsApps Python runtime/stdlib/native-extension/import closure",
              "Closed effective inherited environment and safe semantic-secret policy",
              "Path/basename/cwd/TEMP/output relocation semantics for exact installed engine"
            ]
          },
          "manifest": {
            "schema_version": "0.1",
            "entries": [
              {
                "logical_name": "bambu-studio.exe",
                "sha256": "7680dac4a953cb4f8a96cc2b4ad4ea0b8bfc62f937d3491256922ff24dbb8268",
                "size": "159776",
                "role": "executable"
              }
            ]
          }
        },
        {
          "identity_kind": "resources",
          "metadata": {},
          "closure_policy": {
            "version": "0.1",
            "policy_id": "windows-bambu-02080261-runner020-bounded-v0.1",
            "sha256": "0e723c91813e0c126f43852bf8bf25faf358d66e42e032fa10c4792b520e8af3",
            "status": "INCOMPLETE",
            "path_semantics": "UNRESOLVED",
            "unresolved": [
              "Exact loaded Windows CRT/API-set/system DLL identities and search configuration",
              "Transitive/dynamic BambuStudio.dll dependency set including remaining static import candidates",
              "Exact resource/default/template inheritance and fallback selection with explicit flat profiles",
              "Effective datadir/user config discovery for configured route; current run/job binding not independently established",
              "Actual WindowsApps Python runtime/stdlib/native-extension/import closure",
              "Closed effective inherited environment and safe semantic-secret policy",
              "Path/basename/cwd/TEMP/output relocation semantics for exact installed engine"
            ]
          },
          "manifest": {
            "schema_version": "0.1",
            "entries": [
              {
                "logical_name": "resources/profiles/BBL/cli_config.json",
                "sha256": "89171aefd3ce218b8f2ca2e813a9b2991d1c715658f564a4e47a7b579f9255b1",
                "size": "38685",
                "role": "cli_machine_limits"
              },
              {
                "logical_name": "resources/profiles/BBL/machine/Bambu Lab A1 0.4 nozzle.json",
                "sha256": "645d5038a9b8084e2d30526f81a685e2dacf71ff48703014380125eb646c4d15",
                "size": "2297",
                "role": "default_candidate"
              },
              {
                "logical_name": "resources/profiles/BBL/machine/fdm_bbl_3dp_001_common.json",
                "sha256": "aa5b0148c3131965ab2bb1d377b43301304030c3d87b339897cef98809a9004f",
                "size": "9633",
                "role": "inheritance_candidate"
              },
              {
                "logical_name": "runtime/BambuStudio.dll",
                "sha256": "b480fae45d6e6337bb531f74b8e90b4f4470bef623e1a33e81c03c43f621e768",
                "size": "108991008",
                "role": "bundled_runtime"
              },
              {
                "logical_name": "runtime/libgmp-10.dll",
                "sha256": "fec43cb18ce0ec8a5dd6ad1db745747167310ccb92b5acff0d445a8b3013f009",
                "size": "543027",
                "role": "static_math_runtime_candidate"
              },
              {
                "logical_name": "runtime/libmpfr-4.dll",
                "sha256": "09b3b868b96433991fc15c9c5ae6f9a44c62d2e21194110442607917391ed927",
                "size": "436011",
                "role": "static_math_runtime_candidate"
              }
            ]
          }
        }
      ]
    }
  },
  "files": [
    {
      "logical_name": "bambu-studio.exe",
      "source_path": "J:\\Program Files\\Bambu Studio\\bambu-studio.exe",
      "resolved_path": "J:\\Program Files\\Bambu Studio\\bambu-studio.exe",
      "role": "executable",
      "required": true,
      "expected_sha256": "7680dac4a953cb4f8a96cc2b4ad4ea0b8bfc62f937d3491256922ff24dbb8268",
      "status": "HASHED",
      "observed_bytes": 159776,
      "sha256": "7680dac4a953cb4f8a96cc2b4ad4ea0b8bfc62f937d3491256922ff24dbb8268",
      "before": {
        "size": 159776,
        "mtime_ns": 1787238836000000000,
        "ctime_ns": 1787238836000000000,
        "device": 133144642137240000,
        "inode": 2251799813687966
      },
      "after": {
        "size": 159776,
        "mtime_ns": 1787238836000000000,
        "ctime_ns": 1787238836000000000,
        "device": 133144642137240000,
        "inode": 2251799813687966
      },
      "handle_before": {
        "size": 159776,
        "mtime_ns": 1787238836000000000,
        "ctime_ns": 1788056265341944200,
        "device": 133144642137240000,
        "inode": 2251799813687966
      },
      "handle_after": {
        "size": 159776,
        "mtime_ns": 1787238836000000000,
        "ctime_ns": 1788056265341944200,
        "device": 133144642137240000,
        "inode": 2251799813687966
      },
      "identity_kind": "engine"
    },
    {
      "logical_name": "runtime/BambuStudio.dll",
      "source_path": "J:\\Program Files\\Bambu Studio\\BambuStudio.dll",
      "resolved_path": "J:\\Program Files\\Bambu Studio\\BambuStudio.dll",
      "role": "bundled_runtime",
      "required": true,
      "expected_sha256": null,
      "status": "HASHED",
      "observed_bytes": 108991008,
      "sha256": "b480fae45d6e6337bb531f74b8e90b4f4470bef623e1a33e81c03c43f621e768",
      "before": {
        "size": 108991008,
        "mtime_ns": 1787238830000000000,
        "ctime_ns": 1787238830000000000,
        "device": 133144642137240000,
        "inode": 1970324836977280
      },
      "after": {
        "size": 108991008,
        "mtime_ns": 1787238830000000000,
        "ctime_ns": 1787238830000000000,
        "device": 133144642137240000,
        "inode": 1970324836977280
      },
      "handle_before": {
        "size": 108991008,
        "mtime_ns": 1787238830000000000,
        "ctime_ns": 1788056263727336700,
        "device": 133144642137240000,
        "inode": 1970324836977280
      },
      "handle_after": {
        "size": 108991008,
        "mtime_ns": 1787238830000000000,
        "ctime_ns": 1788056263727336700,
        "device": 133144642137240000,
        "inode": 1970324836977280
      },
      "identity_kind": "resources"
    },
    {
      "logical_name": "runtime/libgmp-10.dll",